{
  "schema_version": 1,
  "scenario_library_id": "scenario_library_draft_8341794bf33058e5",
  "app_id": "zhiyu_ai_hk",
  "fact_snapshot_id": "fact_snapshot_7c19e04928e8cc09",
  "diagnosis_report_id": "diagnosis_report_ec40caa8c9af4055",
  "diagnosis_gap_path": "diagnosis/gaps/diagnosis_report_ec40caa8c9af4055.json",
  "lifecycle": "review_required",
  "version": 1,
  "based_on_scenario_library_id": null,
  "created_at": "2026-08-07T13:05:04Z",
  "confirmed_at": null,
  "scenarios": [
    {
      "scenario_id": "scenario_2fcfb375f6d7e57a",
      "name": "东方命理自我认知工具选购与适用场景",
      "target_customer": "而是帮用户",
      "customer_need": "根据实际使用和采购场景选择合适的知鱼命理AI",
      "concerns": [
        "先调用真实排盘工具再解读，避免排盘靠猜",
        "思考与工具调用过程对用户可见",
        "支持农历转阳历与真太阳时校正后排盘",
        "八字与紫微可叠加印证，并具备对话记忆",
        "SaaS / AI Agent",
        "六爻问事、知鱼AI顾问、八字原局、档案合盘"
      ],
      "representative_questions": [
        {
          "question_id": "scenario_question_033d28174efe918e",
          "text": "知鱼命理AI怎么选？",
          "normalized_text": "知鱼命理ai怎么选",
          "facets": {
            "wording_form": "how_to",
            "regions": [],
            "decision_stage": "consideration",
            "direction": "neutral",
            "product_subject_ids": [
              "sub_product_4f54dcb66ace3aa8"
            ],
            "capability_terms": [],
            "constraints": [
              "先调用真实排盘工具再解读，避免排盘靠猜",
              "思考与工具调用过程对用户可见",
              "支持农历转阳历与真太阳时校正后排盘",
              "八字与紫微可叠加印证，并具备对话记忆"
            ]
          },
          "fact_ids": [
            "fact_0245b72d7d499d87",
            "fact_d3884a88aac534c1",
            "fact_507fbf776ea8478a",
            "fact_461ab2a049b5735a",
            "fact_7242717f4786405c",
            "fact_6423b84f4446063d",
            "fact_d2bb69e415440f50",
            "fact_94de6f7175d8f613",
            "fact_9cb815a23b7858dd"
          ],
          "evidence_gap_ids": [],
          "source_refs": [
            {
              "source_ref_id": "scenario_source_79424857e5879e66",
              "kind": "fact",
              "ref_id": "fact_0245b72d7d499d87",
              "path": null,
              "original_bucket": null,
              "text": "知鱼命理AI",
              "derivation": "operator"
            },
            {
              "source_ref_id": "scenario_source_11dc82b3afe9a573",
              "kind": "fact",
              "ref_id": "fact_d3884a88aac534c1",
              "path": null,
              "original_bucket": null,
              "text": "东方命理自我认知工具",
              "derivation": "derived"
            },
            {
              "source_ref_id": "scenario_source_7efd02078ade9807",
              "kind": "fact",
              "ref_id": "fact_507fbf776ea8478a",
              "path": null,
              "original_bucket": null,
              "text": "先调用真实排盘工具再解读，避免排盘靠猜；思考与工具调用过程对用户可见；支持农历转阳历与真太阳时校正后排盘；八字与紫微可叠加印证，并具备对话记忆",
              "derivation": "derived"
            },
            {
              "source_ref_id": "scenario_source_41c83382fc4ff47b",
              "kind": "fact",
              "ref_id": "fact_461ab2a049b5735a",
              "path": null,
              "original_bucket": null,
              "text": "SaaS / AI Agent；六爻问事、知鱼AI顾问、八字原局、档案合盘；https://zhiyu.hk ; https://app.zhiyu.hk；月卡 ¥99；年卡 ¥599",
              "derivation": "derived"
            },
            {
              "source_ref_id": "scenario_source_f9637fe3093c5e48",
              "kind": "fact",
              "ref_id": "fact_7242717f4786405c",
              "path": null,
              "original_bucket": null,
              "text": "六爻问事解读；八字原局与流年解读；命理图谱记忆与情绪陪伴对话；农历/真太阳时自动处理；合盘与档案连续对话",
              "derivation": "derived"
            },
            {
              "source_ref_id": "scenario_source_5858170eeb5d58f6",
              "kind": "fact",
              "ref_id": "fact_6423b84f4446063d",
              "path": null,
              "original_bucket": null,
              "text": "是",
              "derivation": "operator"
            },
            {
              "source_ref_id": "scenario_source_24b5485b05ae7608",
              "kind": "fact",
              "ref_id": "fact_d2bb69e415440f50",
              "path": null,
              "original_bucket": null,
              "text": "提供六爻问事、知鱼 AI 私人顾问、八字原局与流年解读、档案合盘与连续对话记忆。支持农历输入自动转阳历，并按出生地经纬度计算真太阳时后再排盘；紫微与八字可叠加印证。鱼丸为通用积分，可用于解读与深度对话。公开会员标价为月卡 ¥99、年卡 ¥599。访问入口只记在企业名片，不写入介绍正文。",
              "derivation": "operator"
            },
            {
              "source_ref_id": "scenario_source_3e09a276b1717a4e",
              "kind": "fact",
              "ref_id": "fact_94de6f7175d8f613",
              "path": null,
              "original_bucket": null,
              "text": "核心差异是真实排盘工具补足与可见的工具调用过程，避免“排盘靠猜”。相对西方测评框架，更贴合中国人的时间观、阴阳观与关系观；强调 AI 深度记忆、工具而非预言，赋能自知与决策，而非制造迷信依赖。",
              "derivation": "operator"
            },
            {
              "source_ref_id": "scenario_source_74e802f7d1072830",
              "kind": "fact",
              "ref_id": "fact_9cb815a23b7858dd",
              "path": null,
              "original_bucket": null,
              "text": "市面命理类 AI 常见排盘靠猜，结果难以核验；西方测评框架对中国用户不够贴合；焦虑上升需要自我认知工具，但不愿陷入迷信依赖；农历与真太阳时门槛高，普通人难以自行处理",
              "derivation": "operator"
            },
            {
              "source_ref_id": "scenario_source_837999e9c918e4c9",
              "kind": "diagnosis_gap",
              "ref_id": "gap_034c5d8ed637e40e",
              "path": "diagnosis/gaps/diagnosis_report_ec40caa8c9af4055.json",
              "original_bucket": null,
              "text": "目标品牌在 14/18 条有效正向问题中未被提及。",
              "derivation": "derived"
            },
            {
              "source_ref_id": "scenario_source_c54e8822b8b1085c",
              "kind": "diagnosis_gap",
              "ref_id": "gap_99e37d95fa568e33",
              "path": "diagnosis/gaps/diagnosis_report_ec40caa8c9af4055.json",
              "original_bucket": null,
              "text": "目标品牌在 4 条回答中仅被提及但未被主动推荐。",
              "derivation": "derived"
            }
          ]
        },
        {
          "question_id": "scenario_question_d71e713035b00e93",
          "text": "知鱼命理AI适合哪些使用和采购场景？",
          "normalized_text": "知鱼命理ai适合哪些使用和采购场景",
          "facets": {
            "wording_form": "recommendation",
            "regions": [],
            "decision_stage": "consideration",
            "direction": "neutral",
            "product_subject_ids": [
              "sub_product_4f54dcb66ace3aa8"
            ],
            "capability_terms": [],
            "constraints": [
              "先调用真实排盘工具再解读，避免排盘靠猜",
              "思考与工具调用过程对用户可见",
              "支持农历转阳历与真太阳时校正后排盘",
              "八字与紫微可叠加印证，并具备对话记忆"
            ]
          },
          "fact_ids": [
            "fact_0245b72d7d499d87",
            "fact_d3884a88aac534c1",
            "fact_507fbf776ea8478a",
            "fact_461ab2a049b5735a",
            "fact_7242717f4786405c",
            "fact_6423b84f4446063d",
            "fact_d2bb69e415440f50",
            "fact_94de6f7175d8f613",
            "fact_9cb815a23b7858dd"
          ],
          "evidence_gap_ids": [],
          "source_refs": [
            {
              "source_ref_id": "scenario_source_79424857e5879e66",
              "kind": "fact",
              "ref_id": "fact_0245b72d7d499d87",
              "path": null,
              "original_bucket": null,
              "text": "知鱼命理AI",
              "derivation": "operator"
            },
            {
              "source_ref_id": "scenario_source_11dc82b3afe9a573",
              "kind": "fact",
              "ref_id": "fact_d3884a88aac534c1",
              "path": null,
              "original_bucket": null,
              "text": "东方命理自我认知工具",
              "derivation": "derived"
            },
            {
              "source_ref_id": "scenario_source_7efd02078ade9807",
              "kind": "fact",
              "ref_id": "fact_507fbf776ea8478a",
              "path": null,
              "original_bucket": null,
              "text": "先调用真实排盘工具再解读，避免排盘靠猜；思考与工具调用过程对用户可见；支持农历转阳历与真太阳时校正后排盘；八字与紫微可叠加印证，并具备对话记忆",
              "derivation": "derived"
            },
            {
              "source_ref_id": "scenario_source_41c83382fc4ff47b",
              "kind": "fact",
              "ref_id": "fact_461ab2a049b5735a",
              "path": null,
              "original_bucket": null,
              "text": "SaaS / AI Agent；六爻问事、知鱼AI顾问、八字原局、档案合盘；https://zhiyu.hk ; https://app.zhiyu.hk；月卡 ¥99；年卡 ¥599",
              "derivation": "derived"
            },
            {
              "source_ref_id": "scenario_source_f9637fe3093c5e48",
              "kind": "fact",
              "ref_id": "fact_7242717f4786405c",
              "path": null,
              "original_bucket": null,
              "text": "六爻问事解读；八字原局与流年解读；命理图谱记忆与情绪陪伴对话；农历/真太阳时自动处理；合盘与档案连续对话",
              "derivation": "derived"
            },
            {
              "source_ref_id": "scenario_source_5858170eeb5d58f6",
              "kind": "fact",
              "ref_id": "fact_6423b84f4446063d",
              "path": null,
              "original_bucket": null,
              "text": "是",
              "derivation": "operator"
            },
            {
              "source_ref_id": "scenario_source_24b5485b05ae7608",
              "kind": "fact",
              "ref_id": "fact_d2bb69e415440f50",
              "path": null,
              "original_bucket": null,
              "text": "提供六爻问事、知鱼 AI 私人顾问、八字原局与流年解读、档案合盘与连续对话记忆。支持农历输入自动转阳历，并按出生地经纬度计算真太阳时后再排盘；紫微与八字可叠加印证。鱼丸为通用积分，可用于解读与深度对话。公开会员标价为月卡 ¥99、年卡 ¥599。访问入口只记在企业名片，不写入介绍正文。",
              "derivation": "operator"
            },
            {
              "source_ref_id": "scenario_source_3e09a276b1717a4e",
              "kind": "fact",
              "ref_id": "fact_94de6f7175d8f613",
              "path": null,
              "original_bucket": null,